NODE_KEY,DeptName,DeptDesc,DeptArea,DeptMgr
E3AA81FD-2B2E-4632-8243-331C1F5DE501,Finance,Handles all financial matters,Corporate,John
127AC58A-F6C9-4F38-A068-15A56C18A902,IT,Manages technology and systems,Corporate,Alice
3FF55EA6-975F-4C2B-9AE6-F78726A6FE03,HR,Oversees employee relations and staffing,Corporate,Bob
9F8A0C6B-EC35-4654-BA6C-9A8FF97AC204,Marketing,Focuses on market research and advertising,Corporate,Carol
D17297A2-1553-4DA3-A8AF-3EBD41B1C205,Sales,Responsible for sales and customer relationships,Corporate,David